{
  "version": "1.0",
  "jobId": "11111111-1111-4111-8111-111111111111",
  "correlationId": "aaaaaaaa-aaaa-4aaa-8aaa-aaaaaaaaaaaa",
  "jobType": "RESOLVE_ENTITY",
  "status": "SUCCEEDED",
  "completedAt": "2026-08-20T20:00:03Z",
  "output": {
    "kind": "RESOLVE_ENTITY",
    "resolution": "RESOLVED",
    "selectedMarket": {
      "countryCode": "EC",
      "city": "Quito"
    },
    "candidateCount": 1,
    "evidence": [
      {
        "evidenceId": "22222222-2222-4222-8222-222222222222",
        "classification": "EVIDENCE"
      }
    ]
  },
  "metrics": {
    "durationMs": 3000,
    "attempt": 1
  }
}
